<?xml version="1.0" encoding="UTF-8"?>
<!-- Olga Liliana Ruvalcaba Mata -->

<veterinaria xmlns:xsi="http://www.w3.org/2001/XMLSchema-instance"
        xsi:noNamespaceSchemaLocation="vet.xsd">
  <mascotas>
    <mascota>
      <ID_CLIENTE>C-101</ID_CLIENTE>
      <Nombre_cliente>Carlos Ruiz</Nombre_cliente>
      <Telefono>555-1234</Telefono>
      <Nombre_mascota>Toby</Nombre_mascota>
      <Especie>Perro</Especie>
      <servicios>
        <servicio>
          <Servicio>Baño y Corte</Servicio>
          <Fecha>2026-03-10</Fecha>
          <Costo>350</Costo>
        </servicio>
        <servicio>
          <Servicio>Vacuna antirrábica</Servicio>
          <Fecha>2026-03-10</Fecha>
          <Costo>250</Costo>
        </servicio>
      </servicios>
    </mascota>

    <mascota>
      <ID_CLIENTE>C-102</ID_CLIENTE>
      <Nombre_cliente>Laura Gomez</Nombre_cliente>
      <Telefono>555-5678</Telefono>
      <Nombre_mascota>Michi</Nombre_mascota>
      <Especie>Gato</Especie>
      <servicios>
        <servicio>
          <Servicio>Desparasitación</Servicio>
          <Fecha>2026-03-11</Fecha>
          <Costo>180</Costo>
        </servicio>
        <servicio>
          <Servicio>Limpieza dental</Servicio>
          <Fecha>2026-03-11</Fecha>
          <Costo>400</Costo>
        </servicio>
      </servicios>
    </mascota>

    <mascota>
      <ID_CLIENTE>C-103</ID_CLIENTE>
      <Nombre_cliente>Roberto Diaz</Nombre_cliente>
      <Telefono>555-9012</Telefono>
      <Nombre_mascota>Max</Nombre_mascota>
      <Especie>Perro</Especie>
      <servicios>
        <servicio>
          <Servicio>Revisión general</Servicio>
          <Fecha>2026-03-12</Fecha>
          <Costo>300</Costo>
        </servicio>
        <servicio>
          <Servicio>Corte de uñas</Servicio>
          <Fecha>2026-03-12</Fecha>
          <Costo>100</Costo>
        </servicio>
      </servicios>
    </mascota>
  </mascotas>
</veterinaria>